Nama Rumah Makan,Lokasi,Alamat lengkap,Jam Operasional,Makanan,Masakan,Halal?,Fasilitas
Pepper Lunch,Trans Studio Mall,"Trans Studio Mall, Lantai 2, Jl. Gatot Subroto No. 289, Cibangkong, Batununggal, Bandung",10.00 - 22.00,"Yakiniku, Daging, Nasi",Asia,Ya,Bawa Pulang
Yoshinoya,Trans Studio Mall,"Trans Studio Mall Lantai 2 Unit #D04 & D05, Jl. Gatot Subroto No.289, Cibangkong, Batununggal, Kota Bandung",10.00 - 22.00,"Rice Bowl, Tempura, Katsu","Asia, Jepang",Ya,"Bawa Pulang, Kursi Bayi"
Pago Restaurant,Hotel Papandayan,"Hotel Papandayan, Jl. Gatot Subroto No.83, Malabar, Lengkong, Bandung",18.00 - 22.00,"Sukiyaki, Shabu Shabu",Jepang,?,"Parkir, Reservasi, Kartu Kredit"
Burger King,Trans Studio Mall,"Trans Studio Mall Bandung, Jl. Gatot Subroto No.269-273, Bandung",10.00 - 22.00,"Burger, Kentang Goreng, Ayam Goreng Tepung",Barat,Ya,"Parkir, Kartu Kredit, Kursi Bayi"
Es Teler 77,Trans Studio Mall,"Trans Studio Mall, Lantai 2, Food Court, Jl. Gatot Subroto No. 289, Bandung",10.00 - 22.00,"Bakmi, Bakso, Nasi Goreng, Mie",Indonesia,?,"Bawa Pulang, Wifi, Kartu Kredit"
Hokkaido Baked Cheese Tart,Trans Studio Mall,"Trans Studio Mall Bandung, Lantai 1, Jl. Jendral Gatot Subroto No. 289, Cibangkong, Batununggal, Bandung",10.00 - 22.00,"Kue, Dessert",Jepang,?,Bawa Pulang
Grill Time,Trans Studio Mall,"Trans Studio Mall, Garden Resto Area, Lantai 2, Jl. Gatot Subroto No.289, Cibangkong, Batununggal, Bandung",10.00 - 22.00,BBQ,Asia,?,Bawa Pulang
Shihlin,Trans Studio Mall,"Jl. Buah Batu No.165, Bandung",10.00 - 22.00,"Camilan, Tempura, Kentang Goreng, Katsu",Asia,?,Bawa Pulang
Burger King,Buah Batu,"Jl. Buah Batu No.165, Bandung",00.00 - 23.59,"Burger,Kentang Goreng, Ayam Goreng Tepung",Barat,Ya,"Bawa Pulang, Kartu Kredit"
STW,Buah Batu,"Jl. Palasari No. 45, Bandung",10.00 - 21.00,"Rice Bowl, Pasta","Asia, Barat",?,"Bawa Pulang, Parkir"
Bebek Asap Balcon,Buah Batu,"Jl. Lodaya No. 19, Bandung",10.30 - 21.30,"Bebek, Ayam Goreng, Ayam Geprek, Ikan, Nasi",Indonesia,?,"Bawa Pulang, Parkir, Reservasi"
Makmur Jaya Coffee Roaster,Buah Batu,"Jl. Lengkong Besar No.62, Bandung",07.30 - 23.00,"Rice Bowl, Kentang Goreng, Kopi, Teh",Indonesia,?,"Bawa Pulang, Parkir, Wifi, Kartu Kredit "
X.O Suki,Trans Studio Mall,"Trans Studio Mall Bandung, Lantai Ground, Jl. Jenderal Gatot Subroto No.289, Cibangkong, Batununggal, Bandung",10.00 - 21.30,"Bebek, Sukiyaki, Daging, Ikan","Asia, Jepang",?,"Bawa Pulang, Wifi, Kartu Kredit, Kursi Bayi, Kursi Roda, Area Merokok"
Raffel's Sandwich,Trans Studio Mall,"Trans Studio Mall, Lantai 2, Jl. Gatot Subroto No.289, Bandung",10.00 - 22.00,"Burger, Sandwich, Kentang Goreng",Barat,?,"Bawa Pulang, Kartu Kredit"
Wingz O Wingz,BKR,"Jl. BKR No 93, Bandung",10.00 - 23.00,"Wings, Kentang Goreng",Barat,?,"Bawa Pulang, Parkir"
Warung Nasi ibu Imas,Balong Gede 67,"Jl. Balong Gede No. 67, Bandung",08.00 - 19.00,"Ayam Goreng, Karedok, Ikan, Nasi","Sunda, Indonesia",?,"Bawa Pulang, Parkir, Area Merokok"
Domino's Pizza,Buah Batu,"Jl. Buah Batu No.163, Bandung",10.00 - 23.00,"Pizza, Pasta",Barat,Ya,"Bawa Pulang, Wifi, Kartu Kredit"
Ngopi Doeloe,Burangrang,"Jl. Burangrang No. 27, Bandung",07.00 - 23.00,"Burger, Tom Yum, Nasi Goreng, Pasta, Kopi, Teh","Asia, Italia",?,"Bawa Pulang, Wifi, Kartu Kredit, Kursi Bayi, Kursi Roda"
Sushi Tei,Trans Studio Mall,"Trans Studio Mall, Lantai Ground, Jl. Gatot Subroto No. 289, Cibangkong, Batununggal, Bandung",10.00 - 22.00,"Ramen, Sushi, Ikan, Katsu",Jepang,Ya,"Bawa Pulang, Wifi"
Chingu Korean Fan Cafe,Buah Batu,"Jl. Buah Batu No.218, Bandung",10.00 - 22.00,"Bibimbap, Bulgogi, Topokki,",Korea,?,"Bawa Pulang, Reservasi"
Eatboss,Batununggal,"Jl. MTC Barat No.11, Sekejati, Kec. Buahbatu, Kota Bandung",10.00 - 22.00,"Minuman, Kopi, Teh, Pizza, Pasta",Indonesia,?,"Bawa Pulang, Reservasi"
Rockstar Cafe Bar & Resto,Metro Indah Mall,"Metro Indah Mall, Jl. Soekarno Hatta no. 590, Bandung",10.00 - 00.00,Steak,Barat,?,"Bawa Pulang, Reservasi, Kartu Kredit, Kursi Roda"
Kopi Janji Jiwa,Bandung Kidul,"Jl. Batununggal Indah Raya No.130, Bandung",10.00 - 22.00,"Minuman, Kopi, Teh",Indonesia,?,Bawa Pulang
Restoran Sederhana,Batununggal,"Jl. Soekarno - Hatta No. 508, Bandung",10.00 - 00.00,"Rendang, Ayam Goreng, Gulai, Sate Padang",Padang,?,"Bawa Pulang, Reservasi, Kartu Kredit, Kursi Roda"
Kopi Sedjati,Batununggal,"Jl. Margacinta No.91, Bandung",10.00 - 22.00,"Minuman, Kopi, Teh",?,?,Bawa Pulang
Kedai Kopi Kulo,Bandung Kidul,"Jl. Batununggal Indah IV No. 37, Bandung",09.00 - 19.00,"Minuman, Kopi, Teh, Pizza, Pasta",Indonesia,?,Bawa Pulang
Baso Aci Akang MTC Bandung,Metro Indah Mall,"Komplek Metro Indah Mall, Jl. Soekarno Hatta Blok D No. 57, Sekejati, Kec. Buahbatu, Kota Bandung",10.00 - 22.00,Bakso,Indonesia,?,Bawa Pulang
Rumah Makan Cibiuk Bandung,Batununggal,"Jl. Soekarno Hatta No.508, Batununggal, Bandung Kidul, Bandung",10:00 - 22:00,"Ayam Goreng, Ikan Goreng, Nasi, Ayam Goreng Tepung",Indonesia,?,Parkir
McDonald's,Soekarno Hatta Bandung,"Jl. Soekarno-Hatta No.611, Bandung",00.00 - 23.59,"Burger, Kentang Goreng, Ayam Goreng Tepung",Barat,Ya,"Bawa Pulang, Parkir, Wifi, Reservasi, Area Merokok"
Bakso Malang H. Darmo,Metro Indah Mall,"Metro Indah Mall, Lantai 2, Food Court, Jl. Soekarno Hatta No. 590, Bandung",10.00 - 22.00,Bakso,Indonesia,?,Bawa Pulang
J.CO Donuts & Coffee,Metro Indah Mall,"Metro Indah Mall, Lantai .3, Jl. Soekarno Hatta No. 590, Bandung",10.00 - 22.00,"Kue, Dessert, Kopi, Teh",Indonesia,?,"Bawa Pulang, Kartu Kredit"
Warung Nasi Bebek Sinjay,Batununggal,"Jl. Soekarno Hatta No. 618, Manjahlega, Rancasari, Bandung",09.00 - 22.00,"Bebek, Ayam Goreng, Nasi",Indonesia,?,Bawa Pulang
Daisuki,Metro Indah Mall,"Metro Indah Mall, Lantai .3, Jl. Soekarno Hatta no. 590, Bandung",10.00 - 22.00,"BBQ, Udon, Sukiyaki",Jepang,?,Bawa Pulang
Harliman Boulangerie Patisserie,Bandung Kidul,"Jl. Batununggal Indah Raya no. 164, Bandung",09.00 - 21.00,"Kue, Dessert",Barat,?,Bawa Pulang
Gu-I Korean Grill,Batununggal,"Jl. Batununggal Indah Raya No.425 - 42, Bandung",11.30 - 21.30,BBQ,Korea,?,Bawa Pulang
Tanduk Cau,Batununggal,"Foodlife Griya Batununggal, Jl. Batununggal Indah No. 1, Bandung",10.00 - 22.00,Camilan,Indonesia,?,Bawa Pulang
High School Coffee,Batununggal,"Jl. Batununggal Indah II No. 31A, Batununggal, Bandung Kidul, Bandung",09.00 - 21.00,"Minuman, Kopi, Teh",Indonesia,?,"Bawa Pulang, Wifi"
RM. Bakul Daun,Batununggal,"Jl. Terusan Buah Batu No. 195, Bandung",09.00 - 20.00,"Rendang, Ayam Goreng, Gulai",Padang,?,"Bawa Pulang, Area Merokok"
Ayam Bakar 27 & Sate Cilampeni,Metro Indah Mall,"Metro Indah Mall, Blok G No. 1, Jl. Soekarno Hatta No. 590, Bandung",10.00 - 22.00,"Soto, Ayam Goreng, Nasi Goreng",Indonesia,?,Bawa Pulang
X Crepes,Metro Indah Mall,"Metro Indah Mall, Lantai 2, Food Court, Jl. Soekarno Hatta No. 590, Bandung",10.00 - 22.00,Crepes,Barat,?,Bawa Pulang
Chicken University,Kiaracondong,"Jl. Kiaracondong No. 305, Kebun Kangkung, Kiaracondong, Bandung",11.00 - 21.00,"Ayam Goreng Tepung, Sup",Barat,?,"Bawa Pulang, Parkir, Wifi, Reservasi"
MBS Hotplate,Prama Toserba,"Prama Toserba, Lantai 2, Jl. Babakan Sari 1 No.119, Babakan Sari, Kiaracondong, Bandung",10.00 - 21.00,"Hotpot, Teppanyaki, Steak",Asia,?,"Bawa Pulang, Parkir"
Seafood Hotplate,Prama Toserba,"Prama Toserba, Lantai 2, Jl. Babakan Sari 1 No.119, Bandung",08.00 - 21.30,"Udang, Seafood",?,?,Bawa Pulang
Boba Brownsu D'3,Kiaracondong,"Jl. Babakan Sari 1, Babakan Sari, Kiaracondong, Bandung",10.00 - 22.00,"Minuman, Bubble Tea",?,?,"Bawa Pulang, Parkir"
Haus!,Babakan Sari,"Jl. Babakan Sari 1 No.8, Bandung",10.00 - 21.00,"Minuman, Kopi, Teh",?,?,Bawa Pulang
Donat Madu,Kiaracondong,"Jl. Kiaracondong No. 379A, Kebun Kangkung, Kiaracondong, Bandung",08.00 - 20.00,"Donat, Dessert",?,?,"Bawa Pulang, Parkir"
Rumah Makan Laksana,Kiaracondong,"Jl. Soekarno - Hatta No. 395, Bandung",10.00 - 22.00,"Soto, Ayam Goreng, Mie Goreng, Jajanan Pasar, Makanan Pedas",Sunda,?,"Bawa Pulang, Wifi, Reservasi, Kartu Kredit, Kursi Bayi, Kursi Roda, Area Merokok"
Amanda Brownies Kukus,Kiaracondong,"Jl. Terusan Jakarta No. 6, Babakan Surabaya, Kiaracondong, Bandung",07.00 - 21.00,"Kue, Dessert",?,?,"Bawa Pulang, Parkir"
La'rissa,Kiaracondong,"Jl. Terusan Jakarta No. 77I, Bandung",06.00 - 20.45,"Kue, Dessert",?,?,Bawa Pulang
RM. Sugih Priangan,Kiaracondong,"Jl. Terusan Jakarta No. 48, Babakan Surabaya, Kiaracondong, Bandung",08.00 - 22.00,"Ayam Goreng, Ikan Goreng, Nasi Timbel",Indonesia,?,"Bawa Pulang, Parkir, Wifi, Reservasi, Kursi Bayi, Area Merokok"
Warung Ngopi 821,Kiaracondong,"Jl. Jendral Ahmad Yani No. 821, Padasuka, Kiaracondong, Bandung",10.00 - 22.00,"Pizza, Minuman, Kopi, Teh",?,?,"Bawa Pulang, Parkir, Wifi, Reservasi, Area Merokok"
Fat Oppa Korean BBQ,Kiaracondong,"Jl. Terusan Jakarta No.43, Bandung",11.00 - 22.00,"Bulgogi, Topokki",Jepang,?,Bawa Pulang
Juragan Pempek,Prama Toserba,"Prama Toserba, Lantai 2 Jl. Babakan Sari 1 No.119, Babakan Sari, Kiaracondong,Bandung",10.00 - 21.00,Pempek,Palembang,?,Bawa Pulang
Teh Manis Cafe,Kiaracondong,"Jl. Terusan Gatot Subroto No. 495, Kebun Kangkung, Kiaracondong, Bandung",11.00 - 23.00,"Nasi Campur, Teh, Mie Goreng, Roti Bakar",Indonesia,?,"Bawa Pulang, Parkir, Wifi"
Baso Tahu Aroma,Lucky Square,"Lucky Square, Lantai 2, Food Corner, Jl. Terusan Jakarta No. 2, Babakan Surabaya, Kiaracondong, Bandung",10.00 - 22.00,"Siomay, Bakso",Indonesia,?,"Bawa Pulang, Parkir"
Mechanic Coffee,Kiaracondong,"Jl. Babakan Sari 1 No.4, Babakan Sari, Kiaracondong, Bandung",09.00 - 21.00,"Minuman, Kopi, Teh",?,?,"Bawa Pulang, Parkir, Wifi, Area Merokok"
Cheese Chicken,Kiaracondong,"Jl. Purwakarta No.14, Babakan Surabaya, Kiaracondong, Bandung",08.00 - 21.00,Ayam Goreng Tepung,Barat,?,"Bawa Pulang, Parkir, Wifi"
Martabak Sakura 168,Kiaracondong,"Jl. Ibrahim Adjie No. 250, Kebun Kangkung, Kiaracondong, Bandung",09.00 - 22.15,"Dessert, Martabak",?,?,"Bawa Pulang, Parkir"
Kedai Coger BlazBluz,Kiaracondong,"l. Babakan Sari 1 No.11, Babakan Sari, Kiaracondong, Bandung",13.00 - 23.00,"Minuman, Kopi, Teh",?,?,"Bawa Pulang, Parkir, Wifi, Reservasi, Area Merokok"
Kabobs,Kiaracondong,"Jl. Ibrahim Adjie No. 372A, Binong, Batununggal, Bandung",10.00 - 22.00,Kebab,Turki,?,"Bawa Pulang, Parkir, Wifi"
Mana Cafe,Dago,"Jl. Cibengang No. 17, Bandung",14.00 - 21.00,"Ayam Goreng, Bakso, Nasi Goreng, Kentang Goreng, Kopi, Teh",Indonesia,Ya,"Bawa Pulang, Parkir, Wifi, Reservasi, Area Merokok"
Yagami Ramen House,Coblong,"Jl. Ir H Djuanda No 185, Dago, Coblong, Bandung",10.00 - 22.00,Ramen,Asia,?,"Bawa Pulang, Parkir"
The Harvest,Dago,"Jl. Ir. H. Djuanda No. 15, Bandung",08.00 - 22.00,"Kue, Dessert",?,?,"Bawa Pulang, Parkir, Kartu Kredit"
District Cafe,Dago Atas,"l. Ir. H. Juanda No.339, Bandung",11.00 - 00.00,"Kopi, Teh, Es Krim",Indonesia,?,Bawa Pulang
Swiss Kitchen at Swiss-Belresort,Dago Atas,"Swiss-Belresort Dago Heritage, Lantai Lobby, Jl. Lapangan Golf Dago Atas No. 78, Cigadung, Cibeunying Kaler, Bandung",06.00 - 22.00,"Sushi, Mac and Cheese","Barat, Jepang",?,"Bawa Pulang, Parkir, Wifi, Reservasi, Kartu Kredit, Kursi Bayi, Area Merokok"
Warung Pasta,Dago,"Jl. Ganeca No.4, Bandung",07.00 - 23.00,"Pizza, Pasta",Italia,?,"Bawa Pulang, Parkir, Reservasi, Kartu Kredit, Area Merokok"
Coco Rico,Dago Atas,"Jl. Bukit Pakar Timur No. 19, Bandung",09.00 - 23.00,"BBQ, Ayam Goreng, Nasi Goreng, Steak, Pasta",Barat,?,"Bawa Pulang, Parkir, Wifi, Reservasi, Kartu Kredit, Kursi Roda, Area Merokok"
Sierra Cafe & Lounge,Dago Atas,"Jl. Bukit Pakar No. 33, Bandung",15.00 - 21.00,"Iga, Ayam Goreng, Daging, Pasta, Nasi, Sup","Asia, Barat",?,"Bawa Pulang, Reservasi"
The Parlor,Dago Atas,"Jl. Raya Ranca Kendal Luhur No.9, Gerbang Dago Resort Dago Atas, Bandung",13.00 - 21.00,"Rice Bowl, Ayam Goreng, Steak, Salad","Asia, Barat, Indonesia",?,"Bawa Pulang, Parkir, Wifi, Kartu Kredit, Kursi Roda, Area Merokok"
The Peak Connoisseurs at Swissbell,Resort Dago,"Swissbell-Resort Dago, Jl. Raya Golf Dago No.78, Bandung",10.00 - 23.59,"Minuman, Wine, Soju, Bir",?,?,"Bawa Pulang, Kartu Kredit"
Cafe D'Pakar Bandung,Dago,"Jl. Dago Pakar Utara, Sekejolang, Bandung",11.00 - 18.00,"Ayam Goreng, Mie, Mie Goreng, Roti Bakar","Asia, Indonesia",?,"Bawa Pulang, Parkir, Wifi, Area Merokok"
Skyline Best View Resto,Dago,"Jl. Bukit Pakar Timur No. 108, Bandung",10:00 - 23:00,"Iga, Steak, Pasta, Nasi","Eropa, Asia, Barat, Indonesia",,"Parkir, Wifi, Reservasi, Kartu Kredit, Kursi Bayi, Area Merokok"
Grind Joe Coffee,Dago,"Hotel Moxy, Jl. Ir. H.Djuanda No. 69, Bandung",10.00 - 22.00,"Camilan, Kopi, Teh",?,?,"Bawa Pulang, Parkir, Reservasi, Kartu Kredit"
Gyu Kaku,Bandung Wetan,"Jl. Pangeran Kornel No. 7, Bandung",10.00 - 18.00,BBQ,Jepang,?,"Wifi, Reservasi, Kartu Kredit"
Ngopi Doeloe,Dago Atas,"Jl. Sangkuriang, Dago, Coblong, Bandung",09.00 - 23.00,"Tongseng, Steak, Daging Sapi, Roti Bakar",Indonesia,?,Bawa Pulang
Eat Boss,Dago,"Jl. Ir. H. Juanda No.72, Bandung",10.00 - 22.00,"Nasi Goreng, Sate, Mac and Cheese","Barat, Indonesia",?,Bawa Pulang
Martabak Mertua,Dipatiukur,"Jl. Dipati Ukur No. 84A, Bandung",15.00 - 22.00,"Dessert, Martabak",?,?,Bawa Pulang
Rumah Miring,Dago,"Jl. Dago Giri No. 119, Bandung",11.00 - 00.00,"Pizza, Iga, Wings, Steak, Pasta",Italia,?,"Bawa Pulang, Wifi, Kartu Kredit, Kursi Bayi, Kursi Roda, Area Merokok"
Dago Panyawangan,Dago,"Jl. Ir. H. Juanda No 127, Bandung",10.00 - 23.00,"Ayam Goreng, Nasi Goreng, Ikan, Sop Buntut","Sunda, Indonesia",?,"Bawa Pulang, Parkir, Wifi, Reservasi, Kartu Kredit"
Hanamasa,Dago,"Jl. Ir. H. Juanda No. 48, Bandung",11.00 - 22.00,"Teppanyaki, Daging, Shabu Shabu, Yakiniku",Cina,?,"Bawa Pulang, Parkir, Wifi, Reservasi, Kartu Kredit, Kursi Bayi, Kursi Roda, Area Merokok"
Boda Barn,Lembang,"Jl. Pagermaneuh No. 75, Pagerwangi, Lembang, Bandung Barat",10.00 - 21.00,"Soto, Bebek, Ayam Goreng, Nasi Goreng, Mie",Indonesia,Ya,"Parkir, Reservasi, Area Merokok"
Sapu Lidi,Cihampelas,"Jl. Cihampelas 7, Bandung",09.00 - 22.00,"Bebek, Ayam Goreng, Rica rica",Indonesia,?,"Bawa Pulang, Parkir, Wifi, Reservasi, Kartu Kredit, Kursi Bayi, Area Merokok"
Sapulidi Cafe & Resort,Graha Puspa,"Graha Puspa, Jl. Puspa Raya, Cihideung, Parongpong, Bandung Barat",10.00 - 22.00,"Ayam Goreng, Sate, Ikan Bakar, Gado gado, Ikan Goreng",Sunda,Ya,"Parkir, Wifi, Reservasi, Area Merokok"
Liwet Asep Strawberry,Lembang,"Jl. Raya Lembang - Bandung No. 177, Jayagiri, Lembang, Bandung Barat",07.00 - 22.00,"Ayam Goreng, Jus, Ikan Goreng",Sunda,Ya,Parkir
Imah Seniman,Lembang,"Imah Seniman, Jl. Kolonel Masturi No. 8, Gudangkahuripan, Lembang, Bandung Barat",07.00 - 21.00,"Ayam Goreng, Nasi Goreng, Ikan","Asia, Sunda",Ya,"Parkir, Wifi, Reservasi, Area Merokok"
"Saung Bakakak Lembang ""Khas Nusantara""",Lembang,"Jl. Raya Maribaya No. 124, Langensari, Lembang, Bandung Barat",08.00 - 19.00,"Ayam Bakar, Ayam Goreng, Ikan Goreng, Nasi Goreng",Indonesia,?,"Bawa Pulang, Parkir, Wifi, Reservasi, Kursi Bayi, Area Merokok"
The Barn,Lembang,"Jl. Trinity Kp Daun Blok I No 31 Km 4, Bandung",09.00 - 21.00,"Kue, Kopi, Dessert, Teh",?,?,Bawa Pulang
Burgundy Dine & Wine,Lembang,"Jl. Raya Maribaya No. 163, Langensari, Lembang, Bandung Barat",10.00 - 22.00,"Wine, Burger, Steak, Pasta, Kentang Goreng",Barat,?,"Bawa Pulang, Parkir, Wifi, Reservasi, Kartu Kredit, Kursi Bayi, Kursi Roda, Area Merokok"
Sindang Reret,Lembang,"Jl. Raya Cikole KM . 22 , Cikole, Lembang, Bandung Barat",10.00 - 22.00,"Bebek, Ayam Goreng, Gado Gado, Ikan Goreng, Cumi",Sunda,Ya,"Parkir, Wifi, Reservasi, Area Merokok"
Sei Lelebo,Lembang,"Jl. Punclut No. 234, Ciumbuleuit, Cidadap, Bandung",09.00 - 22.00,"Se'i, Babi, Bir",Indonesia,Tidak,"Wifi, Reservasi, Area Merokok"
RM Tahu Sumedang Renyah,Lembang,"Jl. Raya Lembang No.216, Lembang, Bandung Barat, Bandung",07.00 - 21.00,"Nasi Goreng, Mie Goreng, Nasi Timbel, Tahu",Indonesia,?,"Bawa Pulang, Parkir, Reservasi"
Natural Resto and Strawberry Land,Lembang,"Jl. Raya Tangkuban Parahu No. 109, Cibogo, Lembang, Bandung Barat",09.00 - 18.00,"Pecel, Ayam Goreng, Sate",Indonesia,?,Parkir
Dago Bakery,Lembang,"Jl. Pagermaneuh No. 57, Lembang, Bandung",09.00 - 22.00,"Pizza, Sandwich, Roti, Kue","Barat, Indonesia",Ya,"Parkir, Reservasi, Area Merokok"
Cakrawala Resto,Lembang,"Jl. Pageumaneuh No. 57, Ciumbuleuit, Cidadap, Bandung",09.00 - 22.00,"Pangsit, Mie, Steak, Pasta",Indonesia,Ya,"Parkir, Wifi, Reservasi, Area Merokok"
Tafso Barn,Lembang,"Jl. Baru Laksana No. 75, Pagerwangi, Lembang, Bandung",11.00 - 23.00,"Nasi Goreng, Sushi, Nasi Uduk",Indonesia,Ya,"Parkir, Wifi, Reservasi, Area Merokok"
Tahu Susu Lembang,Lembang,"Jl. Raya Lembang No. 177, Jayagiri, Lembang, Bandung Barat",09.00 - 21.00,"Jajanan Pasar, Tahu",Indonesia,?,"Bawa Pulang, Parkir"
Omah Bamboo Restaurant at The Lodge Maribaya,Lembang,"The Lodge Maribaya, Jl. Maribaya No. 149 , Bandung",08.00 - 18.00,"Ayam Goreng, Nasi",Sunda,?,"Bawa Pulang, Parkir, Reservasi"
The Bale Restaurant,Mulberry Hill The Lodge,"Mulberry Hill By The Lodge, Jl. Maribaya Timur No. 1, Lembang, Bandung Barat, Bandung",07.30 - 22.00,"Nasi Goreng, Pasta, Salad",Indonesia,?,"Parkir, Kartu Kredit"
Saung Pengkolan,Lembang,"Jl. Raya Lembang KM. 12.3 No 35, Gudangkahuripan, Lembang, Bandung Barat",08.00 - 21.30,"Ayam Bakar, Ayam Goreng, Ikan Bakar, Gulai, Ikan Goreng",Sunda,?,"Bawa Pulang, Parkir, Wifi, Kartu Kredit, Kursi Bayi, Area Merokok"
Kaki Bukit Coffee & Yard,Lembang,"Jl. Maribaya No. 16, Kayuambon, Lembang, Bandung Barat",08.00 - 21.00,"Sandwich, Rice Bowl, Kopi, Teh",Asia,?,"Bawa Pulang, Parkir, Wifi, Reservasi, Kartu Kredit, Area Merokok"